{
  "invocation": {
    "args": [
      "semgrep",
      "scan",
      "--config",
      "/rules",
      "--json",
      "--metrics=off",
      "--disable-version-check",
      "/src"
    ],
    "network_profile": "none",
    "timeout_seconds": 120,
    "max_output_bytes": 8388608,
    "finding_exit_codes": [
      0
    ]
  },
  "sandbox_profile": "repo_offline-network-none-v1",
  "guard_binary_digest": "sha256:2406e2b8c2d35af45367c3516066b2f85ddad50639b02f4bd70958b971159752",
  "duration_limit_seconds": 120,
  "schema_version": "1.0",
  "tool_id": "semgrep_ce",
  "tool_version": "1.180.0",
  "tool_image_digest": "sha256:529ee8a277ec8adc5b534d7c74eea0a47e9de21d62852b6ba7ac6ba9566845c3",
  "tool_lock_digest": "sha256:b4adea195b32a9e565dd57a80c69bf799c7138d3a2ea708a3c7a2b5d97dc295b",
  "rule_pack_digest": "sha256:5dd7451cd8a2a49a8613f87096fc3222be6f4386204f43804bef890a6f68b510",
  "source_snapshot": {
    "schema_version": "1.0",
    "input_map_digest": "sha256:1fe34cbffa049c1c3700dd2cd8bb44477b05f90600365c3aea45d9094f912a9a",
    "commit_sha": "",
    "files": [
      {
        "path": "fake-secret.txt",
        "digest": "sha256:46c0c7252868ae400898552b9fa727030310817b4113fcdd5ebeb932d5a5fb22",
        "size": 59
      },
      {
        "path": "package-lock.json",
        "digest": "sha256:4f34fa3e7b13474932c58072bc7293564d6563e4b949dad4ae150f8a27ac80a3",
        "size": 415
      },
      {
        "path": "package.json",
        "digest": "sha256:517b9f5e99e0ad8c41c075193eae10ab4cbc657b7c2f80446a87a47134377d52",
        "size": 176
      },
      {
        "path": "query.py",
        "digest": "sha256:463d921273c5ad7019546e1ad7bebec0e5325dcb21a2a52dfc992089ef72f4bf",
        "size": 171
      }
    ],
    "included_bytes": 821,
    "snapshot_digest": "sha256:c82818a0538ff805fb0f8ac48c419c2c7c9fda077590cb50d0b6551b5418c6a4"
  },
  "started_at": "2026-10-13T01:47:45.519815Z",
  "duration_ms": 2820,
  "exit_code": 0,
  "status": "completed",
  "cleanup_state": "complete",
  "container_id": "aegis-scan-1c65af3e566ecb836d1684efb106358d",
  "result": {
    "status": "completed",
    "findings": [
      {
        "schema_version": "1.0",
        "id": "sha256:59dca14df64e597cfac6dae68b2f75daa008ee86f004b660c94913750eba00f7",
        "app_id": "app_demo",
        "repository_id": "local-operator-repository",
        "category": "static_pattern",
        "summary": "Unverified semgrep_ce finding: rules.aegis.synthetic-python-sql-concat",
        "status": "suspected",
        "severity": "medium",
        "confidence": "low",
        "evidence_tier": "T0",
        "path": "query.py",
        "line": 3,
        "provenance": [
          {
            "tool_id": "semgrep_ce",
            "tool_version": "1.180.0",
            "tool_image_digest": "sha256:529ee8a277ec8adc5b534d7c74eea0a47e9de21d62852b6ba7ac6ba9566845c3",
            "parser_version": "1.1",
            "input_digest": "sha256:c82818a0538ff805fb0f8ac48c419c2c7c9fda077590cb50d0b6551b5418c6a4",
            "rule_id": "rules.aegis.synthetic-python-sql-concat"
          }
        ],
        "coverage_note": "Tool-reported static claim only; no application exploitability or remediation proof.",
        "created_at": "2026-10-13T01:47:49.274122Z"
      }
    ],
    "diagnostics": []
  },
  "limitations": [
    "Read-only tool-reported static claims only; no exploit or remediation proof.",
    "Protected and generated files excluded by inventory; no complete coverage claim.",
    "Only operator-launched network-none scanner containers; no arbitrary repository code execution.",
    "Publisher signatures, licence review, offline advisory database provisioning and full scanner coverage remain pending.",
    "The current Semgrep pack contains only the bundled synthetic rule; it is not a general SAST rule suite."
  ]
}
